[
 {"id": 0, "price": 0.07, "rate": 71.2833, "step": 0.3, "dose": 1.23456789},
 {"id": 1, "price": 19.99, "rate": 8.4583, "step": 0.7, "dose": 0.00000001},
 {"id": 2, "price": 4.35, "rate": 0.0001, "step": 2.3, "dose": 5e-8},
 {"id": 3, "price": 0.075, "rate": 1.00005, "step": 0.35, "dose": 1.234567891}
]
